{
  "version": 1,
  "date": "2026-10-10",
  "source": "apple-health-shortcut",
  "submitted_at": "2026-10-10T06:41:12-07:00",
  "sleep": { "start_at": "2026-10-09T23:05:00-07:00", "end_at": "2026-10-10T06:17:00-07:00", "duration_min": 412 },
  "hrv": { "value_ms": 41.8, "method": "sdnn", "samples": 6 },
  "rhr": { "bpm": 54 },
  "checkin": { "sleep_quality": 3, "energy": 4, "soreness": 2, "stress": 3, "pain": [{ "region": "left-knee", "score": 2 }] }
}
